{
  "$schema": "./badcases.schema.json",
  "version": "1.0",
  "description": "User-reported FAgent badcases. Keep entries chronological and do not delete fixed cases.",
  "updated_at": "2026-05-31",
  "badcases": [
    {
      "id": "BC-20260531-001",
      "date": "2026-05-31",
      "status": "fixed",
      "area": ["agents", "routing"],
      "title": "Self-introduction answer returned raw capability text",
      "query": "你有哪些功能？",
      "expected_answer": "FAgent should use authoritative capability data as context, then synthesize a natural answer. It can summarize market analysis, strategy research, backtesting, optimization, and local paper trading, but must not simply stream the raw describe_fagent tool output.",
      "actual_answer": "The response was the full describe_fagent capability text, streamed almost directly as the final answer.",
      "replay": {
        "cid": 47,
        "message_id": 146,
        "assistant_message_id": 147,
        "history_limit": 10,
        "model": "deepseek-v4-pro",
        "endpoint": "POST /agent/chat/router/stream",
        "notes": "message_id is the user turn mid. Exact replay requires the local conversations database to retain this cid."
      },
      "root_cause": "ReActRouter.process_stream() special-cased TaskType.DESCRIBE_SELF and returned _run_self_description() directly, bypassing model synthesis.",
      "fix": "Use describe_fagent as an authoritative context source, then let the model write the final answer.",
      "verification": [
        "python -m pytest -q passed",
        "API smoke test confirmed the query now returns a synthesized overview"
      ],
      "commit": {
        "hash": "c3166dd",
        "subject": "fix(agent): synthesize self capability answers"
      },
      "regression_tests": [
        "tests/test_react_router.py::TestReActRouter::test_self_description_is_synthesized_from_tool_context"
      ],
      "tags": ["self-description", "tool-output", "answer-quality"]
    },
    {
      "id": "BC-20260531-002",
      "date": "2026-05-31",
      "status": "fixed",
      "area": ["agents", "routing"],
      "title": "Specific market-capability question repeated full self-introduction",
      "query": "你现在能查询最新数据行情吗？",
      "expected_answer": "FAgent should directly answer that it can query stock market data when given a stock name or code, explain the relevant quote/K-line/trend-analysis flow, and mention data-source/cache limits without repeating the complete capability overview.",
      "actual_answer": "The response was effectively the same full capability description returned for 你有哪些功能？.",
      "replay": {
        "cid": 47,
        "message_id": 148,
        "assistant_message_id": 149,
        "history_limit": 10,
        "model": "deepseek-v4-pro",
        "endpoint": "POST /agent/chat/router/stream",
        "notes": "message_id is the user turn mid. Exact replay requires the local conversations database to retain this cid."
      },
      "root_cause": "The router could classify focused capability questions as describe_self. There was no separate task type for concrete ability or boundary questions, and direct passthrough of describe_fagent made the duplicate answer obvious.",
      "fix": "Add TaskType.CAPABILITY_QA for concrete capability questions, normalize overbroad describe_self decisions to capability_qa, and instruct the model not to invent details absent from the authoritative capability data.",
      "verification": [
        "python -m pytest -q passed",
        "API smoke test confirmed the query now answers only the market-data capability question",
        "API smoke test confirmed no unsupported concrete latency claim was added"
      ],
      "commit": {
        "hash": "c3166dd",
        "subject": "fix(agent): synthesize self capability answers"
      },
      "regression_tests": [
        "tests/test_router_policy.py::test_parse_route_response_repairs_overbroad_describe_self",
        "tests/test_router_policy.py::test_fallback_routes_specific_capability_to_capability_qa"
      ],
      "tags": ["capability-qa", "routing", "market-data"]
    },
    {
      "id": "BC-20260531-003",
      "date": "2026-05-31",
      "status": "fixed",
      "area": ["agents", "market", "data"],
      "title": "Market data date question did not use offline fallback",
      "query": "那你能查询得到贵州茅台最近的行情数据是什么时候的呢？",
      "expected_answer": "当实时行情不可用时，FAgent 应回退到本地 QuantMInd 离线日线数据。对于贵州茅台/600519，应回答最新可用交易日是 2026-04-24，明确说明这是本地离线日线快照、不是实时行情，并可简要补充最近日线/收盘价等摘要。",
      "actual_answer": "FAgent said all prior live market tool calls failed and therefore it had no returned data and could not know the last successful market data date.",
      "replay": {
        "cid": 50,
        "message_id": 162,
        "assistant_message_id": 163,
        "history_limit": 10,
        "model": "deepseek-v4-pro",
        "endpoint": "POST /agent/chat/router/stream",
        "notes": "message_id is the user turn mid. Exact replay requires the local conversations database to retain this cid."
      },
      "root_cause": "The market tools currently rely on live AKShare/DatasetManager paths for quote, K-line, trend, and search. BacktestDataLoader already knows how to read QuantMInd feature snapshots, but MarketService does not yet use that offline source as a fallback.",
      "fix": "Added OfflineMarketDataProvider backed by data/stock_data.db, wired quote/K-line/search fallback into MarketService client modes, added QuantMInd import script and fixed concrete stock market-date routing.",
      "verification": [
        "Imported QuantMInd qlib daily data into data/stock_data.db with as_of_date=2026-04-24; generated DB is ignored by git.",
        "Verified /market/quote/600519 returns local:stock_data.db quote dated 2026-04-24 with is_realtime=false.",
        "Verified /market/kline/600519?count=5 returns 2026-04-20 through 2026-04-24 daily bars.",
        "Ran badcase replay with LLM judge: PASS, score=1, report=/tmp/fagent_badcase_bc003_llm.json."
      ],
      "commit": {
        "hash": "21d8c51",
        "subject": "feat(market): add offline QuantMInd data mode"
      },
      "regression_tests": [
        "tests/test_offline_market_provider.py",
        "tests/test_router_policy.py::test_direct_route_concrete_stock_market_date_question_to_kline",
        "tests/test_router_policy.py::test_parse_route_response_repairs_concrete_market_question_from_capability_qa"
      ],
      "tags": ["market-data", "offline-fallback", "quantmind", "kline"]
    }
  ]
}
